# 入力読み	許容するakaza出力	corpus期待値	理由
そんなところにおもしろいものがあるわけでもなし。	そんなところに面白いものがあるわけでもなし。	そんな所に面白い物があるわけでもなし。	style:物→もの
そんなところにこうこくだしてもおれしかみないです	そんなところに広告出しても俺しか見ないです	そんな所に広告出しても俺しか見ないです	style:other
そんなはなしなどきいたことがない	そんな話など聞いたことがない	そんな話など聞いたことが無い	style:無い→ない
たいしたことはないとおもわれるかもしれないが	大したことはないと思われるかもしれないが	大したことは無いと思われるかもしれないが	style:無い→ない
たいとるのものはどうでもよかったんじゃないかというきが	タイトルのものはどうでも良かったんじゃないかという気が	タイトルのものはどうでもよかったんじゃないかという気が	style:良かった→よかった
たいへんしつれいいたしました	大変失礼いたしました	大変失礼致しました	style:other
たすくまねーじゃーをひらいてください	タスクマネージャーを開いてください	タスクマネージャーを開いて下さい	style:下さい→ください
たにんとおなじことをいくらけんめいにやってもいみはない	他人と同じことをいくら懸命にやっても意味はない	他人と同じ事をいくら懸命にやっても意味は無い	style:無い→ない,事→こと
たのしんでいただけましたか？	楽しんでいただけましたか？	楽しんでいただけましたか?	punctuation_style
ちかいもの	近いもの	近い物	style:物→もの
ちょっとすごいところですよ。	ちょっとすごいところですよ。	ちょっとすごい所ですよ。	style:other
つくえにものをおく	机にものを置く	机に物を置く	style:物→もの
つくってもらったものとはけっこうちがいます	作ってもらったものとは結構違います	作ってもらった物とは結構違います	style:物→もの
つごうがつけばでるようにしますがまだわかりません	都合がつけば出るようにしますがまだわかりません	都合がつけば出るようにしますがまだ分かりません	style:分かる→わかる
てれびをおくばしょがないな	テレビを置く場所がないな	テレビを置く場所が無いな	style:無い→ない
でるまくはない	出る幕はない	出る幕は無い	style:無い→ない
でんしゃじこならあるけばいい	電車事故なら歩けばいい	電車事故なら歩けば良い	style:良い→いい
とうけいてきしゅほうをつかうほうめんでいろいろとあたらしいぎじゅつがある	統計的手法を使う方面で色々と新しい技術がある	統計的手法を使う方面でいろいろと新しい技術がある	style:other
とかすもの	溶かすもの	溶かす物	style:物→もの
とくひつすべきてんはほとんどない	特筆すべき点はほとんどない	特筆すべき点はほとんど無い	style:無い→ない
ところかまわず	ところ構わず	所構わず	style:other
ところかわればしなかわる	ところ変われば品変わる	所変われば品変わる	style:other
とてもおいしいです	とても美味しいです	とてもおいしいです	style:other
とてもおいしいです	とても美味しいです	とてもおいしいです	style:other
どうかわったのかな？	どう変わったのかな？	どう変わったのかな?	punctuation_style
どうかんがえればいい	どう考えればいい	どう考えれば良い	style:良い→いい
どうじにしゅうりょうしたのか？	同時に終了したのか？	同時に終了したのか?	punctuation_style
どうじにつかわれることが	同時に使われることが	同時に使われる事が	style:事→こと
どこにいきたいのかな？	どこに行きたいのかな？	どこに行きたいのかな?	punctuation_style
どこまでがほんとうかわかるってもんだ。	どこまでが本当かわかるってもんだ。	どこまでが本当か分かるってもんだ。	style:分かる→わかる
どっかいりょくのないゆとり	読解力のないゆとり	読解力の無いゆとり	style:無い→ない
どっちかがしねばいいのですか？	どっちかが死ねばいいのですか？	どっちかが死ねばいいのですか?	punctuation_style
ないじょうたいに	ない状態に	無い状態に	style:無い→ない
なぜおこっているのかわからない	なぜ怒っているのかわからない	なぜ怒っているのか分からない	style:分かる→わかる
なにがたべられるのかよくわかりません。	何が食べられるのかよくわかりません。	何が食べられるのかよく分かりません。	style:分かる→わかる
なまえはまだない	名前はまだない	名前はまだ無い	style:無い→ない
なまえはまだない	名前はまだない	名前はまだ無い	style:無い→ない
なまでこういうのみるのもいいですよ	生でこういうの見るのもいいですよ	生でこういうの見るのも良いですよ	style:良い→いい
なんいどのさじかげんがわからないらしい	難易度のさじ加減がわからないらしい	難易度のさじ加減が分からないらしい	style:分かる→わかる
なんかいいらのべがあるといいんですけど	なんかいいラノベがあるといいんですけど	何かいいラノベがあるといいんですけど	style:other
なんかいためしてみましたか？	何回試してみましたか？	何回試してみましたか?	punctuation_style
なんかうごきそうですよ	なんか動きそうですよ	何か動きそうですよ	style:other
なんかきたいされているようですが	なんか期待されているようですが	何か期待されているようですが	style:other
なんかさいきんいろんなところでしてるとおもいます	なんか最近いろんなところでしてると思います	何か最近いろんなところでしてると思います	style:other
なんかたのしそうだな	なんか楽しそうだな	何か楽しそうだな	style:other
なんかのぱっけーじの	なんかのパッケージの	何かのパッケージの	style:other
なんかびみょうなわりあてになってる	なんか微妙な割り当てになってる	何か微妙な割り当てになってる	style:other
なんかべつのいみでこわい	なんか別の意味で怖い	何か別の意味で怖い	style:other
なんかほんしつからかけはなれたはなしばかりで	なんか本質からかけ離れた話ばかりで	何か本質からかけ離れた話ばかりで	style:other
なんかむじゅんしてるような	なんか矛盾してるような	何か矛盾してるような	style:other
なんかわからんことがあったらなげてください	なんかわからんことがあったら投げてください	何かわからんことがあったら投げてください	style:other
なんでそんなところにみぶんしょうめいしょがひつようなんだろう	なんでそんなところに身分証明書が必要なんだろう	なんでそんな所に身分証明書が必要なんだろう	style:other
なんとかおわりがみえてきた	何とか終わりが見えてきた	なんとか終わりが見えてきた	style:other
なんのはなしだかわからないかもしれない	なんの話だかわからないかもしれない	なんの話だか分からないかもしれない	style:分かる→わかる
なんらこんきょのないむせきにんなおくそく	何ら根拠のない無責任な憶測	何ら根拠の無い無責任な憶測	style:無い→ない
なんわまでごらんになりました？	何話までご覧になりました？	何話までご覧になりました?	punctuation_style
にほんごじまくはないのです。	日本語字幕はないのです。	日本語字幕は無いのです。	style:無い→ない
ねことはくらしたことないですから、	猫とは暮らしたことないですから、	猫とは暮らしたこと無いですから、	style:無い→ない
ねたにはなりそうにないですな	ネタにはなりそうにないですな	ネタにはなりそうに無いですな	style:無い→ない
ねっとにあくせすできないところ	ネットにアクセスできないところ	ネットにアクセスできない所	style:other
ねておけばよかった	寝ておけばよかった	寝ておけば良かった	style:良かった→よかった
ねむいほうがせんざいのうりょくがはっきされたりしないかな	眠いほうが潜在能力が発揮されたりしないかな	眠い方が潜在能力が発揮されたりしないかな	style:方→ほう
ねんきんせいどについてはふかいぎろんがのぞまれるが、	年金制度については深い議論が望まれるが、	年金制度については深い議論が望まれるが,	punctuation_style
のびのないすとれーとをなげるぴっちゃー	伸びのないストレートを投げるピッチャー	伸びの無いストレートを投げるピッチャー	style:無い→ない
のみかいのあれんじはだれがやるのですか？	飲み会のアレンジは誰がやるのですか？	飲み会のアレンジは誰がやるのですか?	punctuation_style
はいせつぶつのしょりがどうなっているかはわかりません。	排泄物の処理がどうなっているかはわかりません。	排泄物の処理がどうなっているかは分かりません。	style:分かる→わかる
はずれたところにある	外れたところにある	外れた所にある	style:other
はーとがたってどういうこと?	ハート型ってどういうこと?	ハート型ってどういうこと？	punctuation_style
ばすていにいったところ、	バス停に行ったところ、	バス停に行った所、	style:other
ばんごうがかいてあるというじょうほうしかない	番号が書いてあるという情報しかない	番号が書いてあるという情報しか無い	style:無い→ない
ばんめしをかるくくえるところへいかないですか	晩飯を軽く食えるところへ行かないですか	晩飯を軽く食える所へ行かないですか	style:other
ひくいところからのしゃしんかな	低いところからの写真かな	低い所からの写真かな	style:other
ひつようなもの	必要なもの	必要な物	style:物→もの
ひとからしかきふがうけとれないではないか？？	人からしか寄付が受け取れないではないか？？	人からしか寄付が受け取れないではないか??	punctuation_style
ひょうじされるわけではないので	表示されるわけではないので	表示されるわけでは無いので	style:無い→ない
へんこうしなくてもよかったのかなぁというきもします	変更しなくても良かったのかなぁという気もします	変更しなくてもよかったのかなぁという気もします	style:良かった→よかった
べっどをおくばしょがないなぁとおもったらあんのじょう	ベッドを置く場所がないなぁと思ったら案の定	ベッドを置く場所が無いなぁと思ったら案の定	style:無い→ない
ぺんぎんがきょうりゅうだったところまでおもいをはせてください。	ペンギンが恐竜だったところまで思いを馳せてください。	ペンギンが恐竜だった所まで思いを馳せてください。	style:other
ぺんぎんにえいこうあれ！	ペンギンに栄光あれ！	ペンギンに栄光あれ!	punctuation_style
ほとんどないね	ほとんどないね	ほとんど無いね	style:無い→ない
ほんだなをおくばしょがないな	本棚を置く場所がないな	本棚を置く場所が無いな	style:無い→ない
ほんらいおれのすべきことは	本来俺のすべきことは	本来俺のすべき事は	style:事→こと
まいかいおなじじゃないですか？	毎回同じじゃないですか？	毎回同じじゃないですか?	punctuation_style
まいにちだしているわけではないですからねえ	毎日出しているわけではないですからねえ	毎日出しているわけでは無いですからねえ	style:無い→ない
まけたとおもうひつようがないところで	負けたと思う必要がないところで	負けたと思う必要が無い所で	style:無い→ない
みずばかりのんでいたからかな？	水ばかり飲んでいたからかな？	水ばかり飲んでいたからかな?	punctuation_style
みそかつおいしすぎです	味噌カツおいしすぎです	味噌カツ美味しすぎです	style:美味→おいし
みたことないぱたーんにはひくいかくりつをわりあてる	見たことないパターンには低い確率を割り当てる	見たこと無いパターンには低い確率を割り当てる	style:無い→ない
むずかしいこといってる	難しいこと言ってる	難しい事言ってる	style:事→こと
むりなこともためしてみる	無理なことも試してみる	無理な事も試してみる	style:事→こと
めんたーときくとべつのものをおもいうかべる	メンターと聞くと別のものを思い浮かべる	メンターと聞くと別の物を思い浮かべる	style:物→もの
めんどうなことこのうえない。	面倒なことこの上ない。	面倒な事この上ない。	style:事→こと
もうすてられるぎじゅつなのでべつのことをやったほうがよいきがする	もう捨てられる技術なので別のことをやった方が良い気がする	もう捨てられる技術なので別の事をやった方が良い気がする	style:事→こと
もうちょっとてんかいはやくてもよかったですね	もうちょっと展開早くても良かったですね	もうちょっと展開早くてもよかったですね	style:良かった→よかった
もうちょっとようそをおとしてすっきりしてもよかったのかなとおもいます	もうちょっと要素を落としてすっきりしても良かったのかなと思います	もうちょっと要素を落としてすっきりしてもよかったのかなと思います	style:良かった→よかった
もちこみきんしにしてるところもあるな。	持ち込み禁止にしてるところもあるな。	持ち込み禁止にしてる所もあるな。	style:other
もっといいものくえばよい	もっといいもの食えば良い	もっと良い物食えば良い	style:良い→いい,物→もの
もどってきてもいばしょがないばあいがある	戻ってきても居場所がない場合がある	戻ってきても居場所が無い場合がある	style:無い→ない
ものすごいいっぱんてきなことをしゃべってるんですよ	ものすごい一般的なことを喋ってるんですよ	ものすごい一般的な事を喋ってるんですよ	style:事→こと
もののおきばにこまる	ものの置き場に困る	物の置き場に困る	style:物→もの
もんだいがないかかくにんしていただけないでしょうか	問題がないか確認していただけないでしょうか	問題が無いか確認していただけないでしょうか	style:無い→ない
やくしてあるぶぶんもいろいろびみょうのようなきもします	訳してある部分もいろいろ微妙のような気もします	訳してある部分も色々微妙のような気もします	style:色々→いろいろ
やるひつようはない	やる必要はない	やる必要は無い	style:無い→ない
ゆうちょうなことをいってられなかったのー	悠長なことを言ってられなかったのー	悠長な事を言ってられなかったのー	style:事→こと
ゆきがふればいいのに	雪が降ればいいのに	雪が降れば良いのに	style:良い→いい
ゆきのないひでも	雪のない日でも	雪の無い日でも	style:無い→ない
よくわからない	よくわからない	よく分からない	style:分かる→わかる
よやくならばいい	予約ならばいい	予約ならば良い	style:良い→いい
よりよいものになるよう	より良いものになるよう	より良い物になるよう	style:物→もの
りべんとなることをいとしてさくせいしました	利便となることを意図して作成しました	利便となる事を意図して作成しました	style:事→こと
れいぞうこのなかのものがくさりやすくなってきました。	冷蔵庫の中のものが腐りやすくなってきました。	冷蔵庫の中の物が腐りやすくなってきました。	style:物→もの
れいぶんをいろいろとついかする	例文を色々と追加する	例文をいろいろと追加する	style:other
わざわざいえにいくほどのことはない	わざわざ家に行くほどのことはない	わざわざ家に行くほどの事は無い	style:無い→ない,事→こと
わたしがほんとうにほしいもの	私が本当に欲しいもの	私が本当に欲しい物	style:物→もの
わたしのところは、しゅうまつにしょくりょうをまとめがいして、	私のところは、週末に食料をまとめ買いして、	私の所は、週末に食料をまとめ買いして、	style:other
わりにぱふぉーまんすはいい	割にパフォーマンスはいい	割にパフォーマンスは良い	style:良い→いい
わるいところもしっています。	悪いところも知っています。	悪い所も知っています。	style:other
われわれのすこーぷからはずれているのですがどうおかんがえでしょうか？	我々のスコープから外れているのですがどうお考えでしょうか？	我々のスコープから外れているのですがどうお考えでしょうか?	punctuation_style
あきらめてこっちにするべきか	諦めてこっちにするべきか	あきらめてこっちにするべきか	corpus_expects_hiragana
あれはあれでしかたがない。	あれはあれで仕方がない。	あれはあれでしかたがない。	corpus_expects_hiragana
いがいなひとがたすけてくれてうれしいいっぽう	意外な人が助けてくれて嬉しい一方	意外な人が助けてくれてうれしい一方	style:うれしい→嬉しい
いつのまにかそばにきてうれしそうに	いつの間にかそばに来て嬉しそうに	いつの間にかそばに来てうれしそうに	style:うれしい→嬉しい
いろいろとえいきょうがでてきてるのではやくほしいのですよ	いろいろと影響が出てきてるので早くほしいのですよ	いろいろと影響が出てきてるので早く欲しいのですよ	style:ほしい→欲しい
うわさにきいていたとおりのやすさ	噂に聞いていた通りの安さ	噂に聞いていたとおりの安さ	style:とおり→通り
おかんむりだったので	御冠だったので	おかんむりだったので	corpus_expects_hiragana
けいきげんそく	契機減速	けいきげんそく	corpus_expects_hiragana
げいとしてつづけてほしいとはおもうものの	芸として続けてほしいとは思うものの	芸として続けて欲しいとは思うものの	style:ほしい→欲しい
げんさくはまったくしりませんが	原作は全く知りませんが	原作はまったく知りませんが	style:まったく→全く
こうべのときはたぶん	神戸の時は多分	神戸の時はたぶん	style:たぶん→多分
これがたぶんしちょうしゃのみたかったもので	これが多分視聴者の見たかったもので	これがたぶん視聴者の見たかったもので	style:たぶん→多分
これほどうれしいことはありません	これほど嬉しいことはありません	これほどうれしいことはありません	corpus_expects_hiragana
ごしてきのとおり	ご指摘の通り	ご指摘のとおり	style:とおり→通り
さきのめーるのとおり	先のメールの通り	先のメールのとおり	style:とおり→通り
さくじょしてくれるとうれしいです	削除してくれると嬉しいです	削除してくれるとうれしいです	style:うれしい→嬉しい
さんのおっしゃるとおりだとおもいます	さんのおっしゃる通りだと思います	さんのおっしゃるとおりだと思います	style:とおり→通り
しおのほうがおいしかったですよ	塩の方が美味しかったですよ	塩の方がおいしかったですよ	style:おいしい→美味しい
しるなしたんたんめんはおいしい	汁無し坦々麺は美味しい	汁無し坦々麺はおいしい	style:おいしい→美味しい
すさまじかったです	凄まじかったです	すさまじかったです	corpus_expects_hiragana
すさまじかったですね	凄まじかったですね	すさまじかったですね	corpus_expects_hiragana
すべてそろった	全て揃った	すべて揃った	style:すべて→全て
すべてのいぞんかんけいがいんすとーるできません	全ての依存関係がインストールできません	すべての依存関係がインストールできません	style:すべて→全て
すべてのいぞんかんけいをいんすとーるできませんでした	全ての依存関係をインストールできませんでした	すべての依存関係をインストールできませんでした	style:すべて→全て
それがすべてのぜんていです	それが全ての前提です	それがすべての前提です	style:すべて→全て
それはたぶんだいじょうぶですよ	それは多分大丈夫ですよ	それはたぶん大丈夫ですよ	style:たぶん→多分
それはたぶんむりときづきました	それは多分無理と気づきました	それはたぶん無理と気づきました	style:たぶん→多分
たしかにそういうひとたちもうれしいでしょうけど	確かにそういう人たちも嬉しいでしょうけど	確かにそういう人たちもうれしいでしょうけど	style:うれしい→嬉しい
たぶんおおくが	多分多くが	たぶん多くが	style:たぶん→多分
たぶんおたからえいぞうを	多分お宝映像を	たぶんお宝映像を	style:たぶん→多分
たぶんじつげんはしないんじゃないかとおもいます	多分実現はしないんじゃないかと思います	たぶん実現はしないんじゃないかと思います	style:たぶん→多分
たぶんそのぐらいだとおもいます	多分そのぐらいだと思います	たぶんそのぐらいだと思います	style:たぶん→多分
たぶんりそうにちかいのは	多分理想に近いのは	たぶん理想に近いのは	style:たぶん→多分
つっこむべきところなんだろうか	突っ込む冪ところなんだろうか	つっこむべきところなんだろうか	corpus_expects_hiragana
でいけるようになったのが	で行けるようになったのが	でいけるようになったのが	corpus_expects_hiragana
でもたぶんこれって	でも多分これって	でもたぶんこれって	corpus_expects_hiragana
とてもおいしいです	とても美味しいです	とてもおいしいです	corpus_expects_hiragana
どようのいべんとにはぜひさんかしてほしい	土曜のイベントには是非参加してほしい	土曜のイベントには是非参加して欲しい	style:ほしい→欲しい
ながくつかうことをかんがえるとこんかいのへんこうてんはうれしいですけど	長く使うことを考えると今回の変更点は嬉しいですけど	長く使うことを考えると今回の変更点はうれしいですけど	style:うれしい→嬉しい
なめるなよ	舐めるなよ	なめるなよ	corpus_expects_hiragana
なんともない	何ともない	なんともない	corpus_expects_hiragana
につっこみます	にツッコミます	につっこみます	corpus_expects_hiragana
のとおりに	の通りに	のとおりに	corpus_expects_hiragana
のままでいくんですかね	のままで行くんですかね	のままでいくんですかね	corpus_expects_hiragana
はずなのですが	はずなのですが	筈なのですが	style:はず→筈
はたぶんむり	は多分無理	はたぶん無理	style:たぶん→多分
ひどさがよくわかるのぉ	酷さがよくわかるのぉ	ひどさがよくわかるのぉ	corpus_expects_hiragana
ひょうだいのとおりですが	表題の通りですが	表題のとおりですが	style:とおり→通り
ぺーじにかいてあるとおりなんですけど	ページに書いてある通りなんですけど	ページに書いてあるとおりなんですけど	style:とおり→通り
まったくあてにならないさいきょうのとりあわせですが	全く当てにならない最強の取り合わせですが	まったく当てにならない最強の取り合わせですが	style:まったく→全く
