# 入力読み	許容するakaza出力	corpus期待値	理由
# このファイルに記載されたパターンは、evaluate の BAD カウントから除外される。
# 注意: Wikipedia由来の珍語（艦級等）が正解になるケースは accept に入れないこと。
あいしてもいいことはない	愛してもいいことはない	愛しても良い事は無い	style:無い→ない,良い→いい,事→こと
あきはばらでみていたものと	秋葉原で見ていたものと	秋葉原で見ていた物と	style:物→もの
あそぶつもりでしたか？	遊ぶつもりでしたか？	遊ぶつもりでしたか?	punctuation_style
あたらしいなかまとのであいのきっかけになればいい	新しい仲間との出会いのきっかけになればいい	新しい仲間との出会いのきっかけになれば良い	style:良い→いい
あてはまるもの	当てはまるもの	当てはまる物	style:物→もの
あとすこしでいいところまでとうたつする	あと少しでいいところまで到達する	あと少しで良い所まで到達する	style:良い→いい
あなたのきちはすべてわたしのものです	あなたの基地は全て私のものです	あなたの基地は全て私の物です	style:物→もの
あなたはいぬはおすき？	あなたは犬はお好き？	あなたは犬はお好き?	punctuation_style
あなたはどうおもうよ？	あなたはどう思うよ？	あなたはどう思うよ?	punctuation_style
あのおかまであなたのとちですか？	あの丘まであなたの土地ですか？	あの丘まであなたの土地ですか?	punctuation_style
あらためてなのるほどのこともない	改めて名乗るほどのこともない	改めて名乗るほどの事も無い	style:無い→ない,事→こと
ありえないもの	ありえないもの	ありえない物	style:物→もの
あれもほんらいはほとんどないものらしいです	あれも本来はほとんどないものらしいです	あれも本来はほとんど無い物らしいです	style:無い→ない,物→もの
あんてなたんしがあたらしいものとかわっていなければ	アンテナ端子が新しいものと変わっていなければ	アンテナ端子が新しい物と変わっていなければ	style:物→もの
あんまりこころあたりがない	あんまり心当たりがない	あんまり心当たりが無い	style:無い→ない
いいともおもえない	いいとも思えない	良いとも思えない	style:良い→いい
いいばしょないですかね	いい場所ないですかね	良い場所無いですかね	style:無い→ない,良い→いい
いいほんやく	いい翻訳	良い翻訳	style:良い→いい
いえでまでしごとのことはかんがえたくない？	家でまで仕事のことは考えたくない？	家でまで仕事のことは考えたくない?	punctuation_style
いしょうきせたっていみないって。	衣装着せたって意味ないって。	衣装着せたって意味無いって。	style:無い→ない
いただいためーるへのへんじはまたつぎに	いただいたメールへの返事はまた次に	頂いたメールへの返事はまた次に	style:other
いたるところにけっかんがあります。	至るところに欠陥があります。	至る所に欠陥があります。	style:other
いったことないので、	行ったことないので、	行ったこと無いので、	style:無い→ない
いぬようはないですからねえ。	犬用はないですからねえ。	犬用は無いですからねえ。	style:無い→ない
いのちにべつじょうはない	命に別状はない	命に別状は無い	style:無い→ない
いまのところはすべてかいてありますけど、	今のところは全て書いてありますけど、	今の所は全て書いてありますけど、	style:other
いままできいたことないさっきょくかを	今まで聞いたことない作曲家を	今まで聞いたこと無い作曲家を	style:無い→ない
いままでみたことのないおおきさのものをみた	今まで見たことのない大きさのものを見た	今まで見たことのない大きさの物を見た	style:物→もの
いらすとがいいところばかりでとてもよかったのがいんしょうてきです	イラストがいいところばかりでとても良かったのが印象的です	イラストがいいところばかりでとてもよかったのが印象的です	style:良かった→よかった
いれかえたほうが	入れ替えたほうが	入れ替えた方が	style:方→ほう
いろいろしこんでおく	いろいろ仕込んでおく	色々仕込んでおく	style:色々→いろいろ
いろいろためしたところ、	いろいろ試したところ、	色々試したところ、	style:色々→いろいろ
いろいろとようきゅうがあるので	いろいろと要求があるので	色々と要求があるので	style:色々→いろいろ
いろんなものをつくっているようです	いろんなものを作っているようです	いろんな物を作っているようです	style:物→もの
いろんはないですよね。	異論はないですよね。	異論は無いですよね。	style:無い→ない
うすがたてれびさえもおくばしょがないな	薄型テレビさえも置く場所がないな	薄型テレビさえも置く場所が無いな	style:無い→ない
うすがたてれびをかったが、おくばしょがないのがこまりどころだ	薄型テレビを買ったが、置く場所がないのが困りどころだ	薄型テレビを買ったが、置く場所が無いのが困りどころだ	style:無い→ない
うみのものともやまのものともつかない	海のものとも山のものともつかない	海の物とも山の物ともつかない	style:物→もの
えいきょうりょくはないだろ。	影響力はないだろ。	影響力は無いだろ。	style:無い→ない
えんぎのあるぶたいであれば、かしゅはいろいろとうごくわけですが、	演技のある舞台であれば、歌手はいろいろと動くわけですが、	演技のある舞台であれば、歌手は色々と動くわけですが、	style:色々→いろいろ
おくばしょがない	置く場所がない	置く場所が無い	style:無い→ない
おくばにものがはさまる	奥歯にものが挟まる	奥歯に物が挟まる	style:物→もの
おしとおしたほうがいいのか	押し通したほうがいいのか	押し通した方がいいのか	style:方→ほう
おどされてのことだった	脅されてのことだった	脅されての事だった	style:事→こと
おなじもの	同じもの	同じ物	style:物→もの
おりるほうがあっとうてきにらくだ	降りるほうが圧倒的に楽だ	降りる方が圧倒的に楽だ	style:方→ほう
かいはつがよういなことから	開発が容易なことから	開発が容易な事から	style:事→こと
かいはつちゅうのものにあんいにてをださないようにする	開発中のものに安易に手を出さないようにする	開発中の物に安易に手を出さないようにする	style:物→もの
かうつもりはさらさらないので、	買うつもりはさらさらないので、	買うつもりはさらさら無いので、	style:無い→ない
かえりのでんしゃのなかでいろいろとおしえてもらった	帰りの電車の中で色々と教えてもらった	帰りの電車の中でいろいろと教えてもらった	style:other
かえれないところだった	帰れないところだった	帰れない所だった	style:other
かがくてきなこんきょはない	科学的な根拠はない	科学的な根拠は無い	style:無い→ない
かこのことはもうわすれて、	過去のことはもう忘れて、	過去の事はもう忘れて、	style:事→こと
かざりけのない	飾り気のない	飾り気の無い	style:無い→ない
かねとってもなっとくするようなもの	金取っても納得するようなもの	金取っても納得するような物	style:物→もの
かろんずることがないように	軽んずることがないように	軽んずることが無いように	style:無い→ない
がいこうほうしんにてんかんはない	外交方針に転換はない	外交方針に転換は無い	style:無い→ない
がっこうではない	学校ではない	学校では無い	style:無い→ない
がんばってほしいところである	頑張ってほしいところである	頑張ってほしい所である	style:other
きいたことないけど	聞いたことないけど	聞いたこと無いけど	style:無い→ない
きいてみたいところです。	聞いてみたいところです。	聞いてみたい所です。	style:other
きかくしてはどうでしょうか？	企画してはどうでしょうか？	企画してはどうでしょうか?	punctuation_style
きかくものっぽいです。	企画ものっぽいです。	企画物っぽいです。	style:物→もの
きどうするのがおそいだけだということがわかった	起動するのが遅いだけだということがわかった	起動するのが遅いだけだということが分かった	style:分かる→わかる
きになるところだが	気になるところだが	気になる所だが	style:other
きのうならよかった	昨日ならよかった	昨日なら良かった	style:良かった→よかった
きのうよりいいてんき	昨日よりいい天気	昨日より良い天気	style:良い→いい
きゃすともよかったですね	キャストも良かったですね	キャストもよかったですね	style:良かった→よかった
きょうはいいてんきですね	今日はいい天気ですね	今日は良い天気ですね	style:良い→いい
きょねんのものにたいしてです。	去年のものに対してです。	去年の物に対してです。	style:物→もの
きりわけたほうがよいですね。	切り分けたほうが良いですね。	切り分けた方が良いですね。	style:方→ほう
きんきゅうどがたかいもの	緊急度が高いもの	緊急度が高い物	style:物→もの
きんきゅうどのひくいもの	緊急度の低いもの	緊急度の低い物	style:物→もの
きんようびのしんやだから？	金曜日の深夜だから？	金曜日の深夜だから?	punctuation_style
ぎわくにかんしてしゃくめいするよていはない	疑惑に関して釈明する予定はない	疑惑に関して釈明する予定は無い	style:無い→ない
ぎんえんかめらはしゅみのひとのためのものになってしまった。	銀塩カメラは趣味の人のためのものになってしまった。	銀塩カメラは趣味の人のための物になってしまった。	style:物→もの
くったくのないひょうじょう	屈託のない表情	屈託の無い表情	style:無い→ない
くもひとつないえんてんかで	雲一つない炎天下で	雲一つ無い炎天下で	style:無い→ない
くるまにつんだほうがいいとおもう	車に積んだほうがいいと思う	車に積んだ方がいいと思う	style:方→ほう
けっきょくどれにでるのでしょうか？	結局どれに出るのでしょうか？	結局どれに出るのでしょうか?	punctuation_style
けっしてそんなことはないとおもいます	決してそんなことはないと思います	決してそんなことは無いと思います	style:無い→ない
げんいんがわかったので	原因が分かったので	原因がわかったので	style:分かる→わかる
げんさくとでざいんのふんいきがちがいすぎてよくわからない	原作とデザインの雰囲気が違いすぎてよくわからない	原作とデザインの雰囲気が違いすぎてよく分からない	style:分かる→わかる
こうかいきかんがあるので、あせってみるひつようはないですが。	公開期間があるので、焦って見る必要はないですが。	公開期間があるので、焦って見る必要は無いですが。	style:無い→ない
こうかんがえればいい	こう考えればいい	こう考えれば良い	style:良い→いい
こうかんがえればいい	こう考えればいい	こう考えれば良い	style:良い→いい
こうせいにはへんこうないとのことです	構成には変更ないとのことです	構成には変更無いとのことです	style:無い→ない
こころがけたほうが	心がけたほうが	心がけた方が	style:方→ほう
こだわりはない	こだわりはない	こだわりは無い	style:無い→ない
こっちではなんかかうかも	こっちではなんか買うかも	こっちでは何か買うかも	style:other
ことここにいたっては	ことここに至っては	事ここに至っては	style:事→こと
このいぬはよくなきますか？	この犬はよく鳴きますか？	この犬はよく鳴きますか?	punctuation_style
このこはかなしくてないているのですか？	この子は悲しくて泣いているのですか？	この子は悲しくて泣いているのですか?	punctuation_style
このじしんによるつなみのしんぱいはない	この地震による津波の心配はない	この地震による津波の心配は無い	style:無い→ない
このすずむしはよくなきますか？	この鈴虫はよく鳴きますか？	この鈴虫はよく鳴きますか?	punctuation_style
このとりはよくなきますか？	この鳥はよく鳴きますか？	この鳥はよく鳴きますか?	punctuation_style
このねこはよくなきますか？	この猫はよく鳴きますか？	この猫はよく鳴きますか?	punctuation_style
このはなしは、これでおしまい。	この話は、これでおしまい。	この話は,これでおしまい。	punctuation_style
このひときょねんもおうぼしてませんでしたっけ？	この人去年も応募してませんでしたっけ？	この人去年も応募してませんでしたっけ?	punctuation_style
このへやにしゅうのうはありますか？	この部屋に収納はありますか？	この部屋に収納はありますか?	punctuation_style
これでいいのかしらんけどな	これでいいのか知らんけどな	これで良いのか知らんけどな	style:良い→いい
これでいいのかどうかしりませんが	これでいいのかどうか知りませんが	これで良いのかどうか知りませんが	style:良い→いい
これはばぐだとはんだんしてよろしいでしょうか？	これはバグだと判断してよろしいでしょうか？	これはバグだと判断してよろしいでしょうか?	punctuation_style
これをつかおうか？	これを使おうか？	これを使おうか?	punctuation_style
これをつかおうなんておもってる？	これを使おうなんて思ってる？	これを使おうなんて思ってる?	punctuation_style
こんきはれぎゅらーないような	今季はレギュラーないような	今季はレギュラー無いような	style:無い→ない
こんなことかいて	こんなこと書いて	こんな事書いて	style:事→こと
こんなところにもくるんだなぁ	こんなところにも来るんだなぁ	こんな所にも来るんだなぁ	style:other
こんなにかわいいのにおとこのこのはずがない	こんなに可愛いのに男の子のはずがない	こんなに可愛いのに男の子のはずが無い	style:無い→ない
こんなのぬげばいい	こんなの脱げばいい	こんなの脱げば良い	style:良い→いい
こんなんでよいのかな？	こんなんで良いのかな？	こんなんで良いのかな?	punctuation_style
ごかくにんください。	ご確認ください。	ご確認下さい。	style:下さい→ください
ごぜんちゅうにはぷれすりりーすがでていたのですが、いつのまにかきえていました	午前中にはプレスリリースが出ていたのですが、いつの間にか消えていました	午前中にはプレスリリースが出ていたのですが,いつの間にか消えていました	punctuation_style
さいしんのあっぷでーとまであげておけば？	最新のアップデートまで上げておけば？	最新のアップデートまで上げておけば?	punctuation_style
さいだいちをもとめるところでいっぱいつかってるようなきがします	最大値を求めるところでいっぱい使ってるような気がします	最大値を求める所でいっぱい使ってるような気がします	style:other
さがみこをすぎたところでみぎがわしゃせんをはしっていた	相模湖を過ぎたところで右側車線を走っていた	相模湖を過ぎた所で右側車線を走っていた	style:other
さんしょうわたしをつかうといろいろややこしいもんだいがおきる	参照渡しを使うと色々ややこしい問題が起きる	参照渡しを使うといろいろややこしい問題が起きる	style:other
さーびすのほうがいいんじゃねーの、とおもいますよ	サービスの方がいいんじゃねーの、と思いますよ	サービスのほうがいいんじゃねーの、と思いますよ	style:方→ほう
ざいりょうがまったくないためうれたんでだいようした	材料が全くないためウレタンで代用した	材料が全く無いためウレタンで代用した	style:無い→ない
ざっしはよまないひとだったっけ？	雑誌は読まない人だったっけ？	雑誌は読まない人だったっけ?	punctuation_style
しおのほうがおいしかったですよ	塩の方が美味しかったですよ	塩の方がおいしかったですよ	style:other
しかしなんかびみょうなよかん	しかしなんか微妙な予感	しかし何か微妙な予感	style:other
しきんじゅようがていちょうなことから	資金需要が低調なことから	資金需要が低調な事から	style:事→こと
しごとのこと	仕事のこと	仕事の事	style:事→こと
しごとのこと	仕事のこと	仕事の事	style:事→こと
しごのことは	死後のことは	死後の事は	style:事→こと
しじょうをくいあうしんぱいはない。	市場を食い合う心配はない。	市場を食い合う心配は無い。	style:無い→ない
しつれいながらもくてきをおたずねしてよろしいでしょうか？	失礼ながら目的をお尋ねしてよろしいでしょうか？	失礼ながら目的をお尋ねしてよろしいでしょうか?	punctuation_style
しゅくじつでしたか？	祝日でしたか？	祝日でしたか?	punctuation_style
しょうぶすべきところでしょうぶする	勝負すべきところで勝負する	勝負すべき所で勝負する	style:other
しょっきだなをおくばしょがないなとおもった	食器棚を置く場所がないなと思った	食器棚を置く場所が無いなと思った	style:無い→ない
しるなしたんたんめんはおいしい	汁無し坦々麺は美味しい	汁無し坦々麺はおいしい	style:other
しるなしたんたんめんをつくれますか？	汁無し坦々麺を作れますか？	汁無し坦々麺を作れますか?	punctuation_style
しんこくにかんがえこむはなしではない	深刻に考え込む話ではない	深刻に考え込む話では無い	style:無い→ない
しんぷるでうつくしくせんれんされたもの	シンプルで美しく洗練されたもの	シンプルで美しく洗練された物	style:物→もの
じかんがない	時間がない	時間が無い	style:無い→ない
じかんのないなかで	時間のない中で	時間の無い中で	style:無い→ない
じぶんでみつけなくてはいみがない	自分で見つけなくては意味がない	自分で見つけなくては意味が無い	style:無い→ない
じぶんのことはべつとしてつぎのばーじょんはだれがつくるんでしょうかね	自分のことは別として次のバージョンは誰が作るんでしょうかね	自分の事は別として次のバージョンは誰が作るんでしょうかね	style:事→こと
じゅうにしちょうなんですか？	十二指腸なんですか？	十二指腸なんですか?	punctuation_style
じゅかいのみつどのこさがわかる	樹海の密度の濃さがわかる	樹海の密度の濃さが分かる	style:分かる→わかる
じょうけんがくうもじれつのものがあるので	条件が空文字列のものがあるので	条件が空文字列の物があるので	style:物→もの
じょうじょうしゃくりょうのよちがない	情状酌量の余地がない	情状酌量の余地が無い	style:無い→ない
じょうじょうするきがないなら	上場する気がないなら	上場する気が無いなら	style:無い→ない
せいじてきやしんはない	政治的野心はない	政治的野心は無い	style:無い→ない
せっせんのときにじぶんのことだとしゅちょうするやつがいる	接戦の時に自分のことだと主張する奴がいる	接戦の時に自分の事だと主張する奴がいる	style:事→こと
ぜんごのないようもきーにするものなどいろいろあります	前後の内容もキーにするものなど色々あります	前後の内容もキーにするものなどいろいろあります	style:other
ぜんたいてきにとういつをおこなったほうがいいでしょう	全体的に統一を行った方がいいでしょう	全体的に統一を行ったほうがいいでしょう	style:方→ほう
そういうはなしはあまりない	そういう話はあまりない	そういう話はあまり無い	style:無い→ない
そういうものをちょくしするのはさけたほうがいい	そういうものを直視するのは避けた方がいい	そういうものを直視するのは避けた方が良い	style:良い→いい
そうおもったところで	そう思ったところで	そう思った所で	style:other
そうかんがえればいい	そう考えればいい	そう考えれば良い	style:良い→いい
そこそこちいさいのでげーむをつくるのにいいかも	そこそこ小さいのでゲームを作るのにいいかも	そこそこ小さいのでゲームを作るのに良いかも	style:良い→いい
そのてのせつびはだいがくにしかないとおもっていました	その手の設備は大学にしかないと思っていました	その手の設備は大学にしか無いと思っていました	style:無い→ない
そのてのわだいはひかえたほうがいいのではありませんか？	その手の話題は控えた方がいいのではありませんか？	その手の話題は控えた方が良いのではありませんか?	style:良い→いい,?→？
そのひをさいこうのえがおでむかえていただくため、	その日を最高の笑顔で迎えていただくため、	その日を最高の笑顔で迎えて頂くため、	style:other
そのもんだいをあつかったことはない	その問題を扱ったことはない	その問題を扱った事はない	style:事→こと
そのようなけつろんがだせるじょうきょうではない	そのような結論が出せる状況ではない	そのような結論が出せる状況では無い	style:無い→ない
それはもうかこのことです	それはもう過去のことです	それはもう過去の事です	style:事→こと
それをなんとかするりそーすはない	それを何とかするリソースはない	それを何とかするリソースは無い	style:無い→ない
そろそろいろいろとやばくなってきた	そろそろいろいろとやばくなってきた	そろそろ色々とやばくなってきた	style:色々→いろいろ
そんなかんたんなげんいんだったのですか？	そんな簡単な原因だったのですか？	そんな簡単な原因だったのですか?	punctuation_style
そんなことができるかなと	そんなことができるかなと	そんな事ができるかなと	style:事→こと
そんなことのないようおねがいします	そんなことのないようお願いします	そんな事の無いようお願いします	style:無い→ない,事→こと
そんなことはないとだんげんしてほしいところですが	そんなことはないと断言してほしいところですが	そんなことは無いと断言してほしいところですが	style:無い→ない
そんなことはまったくないです。	そんなことは全くないです。	そんなことは全く無いです。	style:無い→ない
そんなところだけおーぷんそーすにされてもこまる	そんなところだけオープンソースにされても困る	そんな所だけオープンソースにされても困る	style:other
そんなところでかいぜんがみられてもいみがない	そんなところで改善が見られても意味がない	そんな所で改善が見られても意味が無い	style:無い→ない
そんなところではなくて、	そんなところではなくて、	そんな所ではなくて、	style:other
