# 入力読み	許容するakaza出力	corpus期待値	理由
まったくいしきしてなかったんで	全く意識してなかったんで	まったく意識してなかったんで	style:まったく→全く
まったくそのとおりで	全くその通りで	まったくその通りで	style:まったく→全く
まったくのぼれるきがしない	全く登れる気がしない	まったく登れる気がしない	style:まったく→全く
まったくもんだいありませんし	全く問題ありませんし	まったく問題ありませんし	style:まったく→全く
まったくわけがわかりません	全くわけがわかりません	まったくわけがわかりません	corpus_expects_hiragana
みそかつおいしすぎです	味噌カツおいしすぎです	味噌カツ美味しすぎです	style:おいしい→美味しい
めんしきがないはず	面識がないはず	面識がない筈	style:はず→筈
もうそうするしか	妄想するしか	もうそうするしか	corpus_expects_hiragana
もっとたまってからください	もっと溜まってからください	もっとたまってからください	corpus_expects_hiragana
やまにのぼりたいとはまったくおもいません	山に登りたいとは全く思いません	山に登りたいとはまったく思いません	style:まったく→全く
やみはすべてをとかす	闇は全てを溶かす	闇はすべてを溶かす	style:すべて→全て
やりとりしたことがあったので	やり取りしたことがあったので	やりとりしたことがあったので	corpus_expects_hiragana
わからなくなりつつあります	分からなくなりつつあります	わからなくなりつつあります	corpus_expects_hiragana
をふくむすべてをひょうじ	を含む全てを表示	を含むすべてを表示	style:すべて→全て
きた	着た	来た	short_ambiguous
きもいり	肝煎	肝煎り	short_ambiguous
けいきげんそく	契機減速	けいきげんそく	short_ambiguous
こぶり	小ぶり	小降り	short_ambiguous
ごばん	五番	語版	short_ambiguous
ごまかす	ごまかす	誤魔化す	short_ambiguous
ごますり	胡麻擂り	胡麻すり	short_ambiguous
さんそう	山荘	三相	short_ambiguous
しゃたつ	社建つ	社逹	short_ambiguous
しゅつず	出ず	出図	short_ambiguous
しゅとう	種痘	手刀	short_ambiguous
そこう	素行	粗鋼	short_ambiguous
たんそう	炭層	単相	short_ambiguous
だいめは	だいめは	台目は	short_ambiguous
とびきり	とびきり	飛び切り	short_ambiguous
なでがた	なで肩	撫で肩	short_ambiguous
なまゆで	生ゆで	生茹で	short_ambiguous
なをなす	なをなす	名を成す	short_ambiguous
ふんご	フン語	分後	short_ambiguous
みます	みます	見ます	short_ambiguous
めしくえ	飯くえ	飯食え	short_ambiguous
もうだめ	もうだめ	もうダメ	short_ambiguous
もちやで	餅屋で	持ち家で	short_ambiguous
ようかぐ	よう家具	洋家具	short_ambiguous
よきかな	よ気かな	良き哉	short_ambiguous
わって	割って	話って	short_ambiguous
わですな	わですな	話ですな	short_ambiguous
わを	わを	話を	short_ambiguous
いつもとかわらずできそうなのでしょうか	いつもと変わらずできそうなのでしょうか	いつもと変わらず出来そうなのでしょうか	style:出来→でき
いまはすきーはできないんですよ。	今はスキーはできないんですよ。	今はスキーは出来ないんですよ。	style:出来→でき
おもしろいはなしがたくさんあります。	面白い話がたくさんあります。	面白い話が沢山あります。	style:沢山→たくさん
からーしゃしんもきれいだとおもえました	カラー写真もきれいだと思えました	カラー写真も綺麗だと思えました	style:綺麗→きれい
きょうかいしゃでへんかんできなかったたんごは	今日会社で変換できなかった単語は	今日会社で変換出来なかった単語は	style:出来→でき
きれいにおわりました	きれいに終わりました	綺麗に終わりました	style:綺麗→きれい
きれいにさくらがさいている	きれいに桜が咲いている	綺麗に桜が咲いている	style:綺麗→きれい
これによりまきかえしをはかることができるでしょうか	これにより巻き返しを図ることができるでしょうか	これにより巻き返しを図ることが出来るでしょうか	style:出来→でき
そのようなひとはよのなかにたくさんいて、	そのような人は世の中にたくさんいて、	そのような人は世の中に沢山いて、	style:沢山→たくさん
たいざいできないでしょう。	滞在できないでしょう。	滞在出来ないでしょう。	style:出来→でき
たいふうによりこくどうがかんすいしたため、しゅうらくがこりつした	台風により国道が冠水したため、集落が孤立した	台風により国道が冠水した為、集落が孤立した	style:為→ため
たのしそうにできた	楽しそうにできた	楽しそうに出来た	style:出来→でき
でんちがきれてにゅうりょくできませんでした。	電池が切れて入力できませんでした。	電池が切れて入力出来ませんでした。	style:出来→でき
ねんのためおくっておきます。	念の為送っておきます。	念のため送っておきます。	style:為→ため
ぱっちをあてればできるかもしれないが	パッチを当てればできるかもしれないが	パッチを当てれば出来るかもしれないが	style:出来→でき
ふるいままなのであくせすできませんでした	古いままなのでアクセスできませんでした	古いままなのでアクセス出来ませんでした	style:出来→でき
ほとんどせんだいきんこうでしか	ほとんど仙台近郊でしか	殆ど仙台近郊でしか	style:殆ど→ほとんど
ほんとにきれいにはいりますね	ほんとに綺麗に入りますね	ほんとにきれいに入りますね	style:綺麗→きれい
みぢかなばしょにしぜんたくさんあってよいですね。	身近な場所に自然たくさんあって良いですね。	身近な場所に自然沢山あって良いですね。	style:沢山→たくさん
むさべつにつかうことができれば、	無差別に使うことができれば、	無差別に使うことが出来れば、	style:出来→でき
わかくてきれいなおんなのこは	若くて綺麗な女の子は	若くてきれいな女の子は	style:綺麗→きれい
わりときれいだ	割ときれいだ	割と綺麗だ	style:綺麗→きれい
あまりにていはつねつかつせいおんで	あまりに低発熱かつ静音で	余りに低発熱かつ静音で	style:余り↔あまり
いきのでんしゃおよびかいしゃでねむけとたたかった	行きの電車および会社で眠気と戦った	行きの電車及び会社で眠気と戦った	style:及び↔および
いそうとくせいのへんかがなく	位相特性の変化がなく	位相特性の変化が無く	style:無く↔なく
おなじばーじょんがすでにいんすとーるされています	同じバージョンが既にインストールされています	同じバージョンがすでにインストールされています	style:既に↔すでに
おやはなくともこはそだつ	親はなくとも子は育つ	親は無くとも子は育つ	style:無く↔なく
きくじかんがなくなりそうですが。	聞く時間がなくなりそうですが。	聞く時間が無くなりそうですが。	style:無く↔なく
きゅうじつはいえにいるよりは、がいしゅつしたほうがすずしいですね。	休日は家にいるよりは、外出した方が涼しいですね。	休日は家に居るよりは、外出した方が涼しいですね。	style:居る↔いる
げんだんかいですでに	現段階で既に	現段階ですでに	style:既に↔すでに
こーぱすのこうちくおよびあくせすをおこなう	コーパスの構築およびアクセスを行う	コーパスの構築及びアクセスを行う	style:及び↔および
すでにらいばるたすう	既にライバル多数	すでにライバル多数	style:既に↔すでに
せいかなくしゅうりょうした	成果なく終了した	成果無く終了した	style:無く↔なく
ただし、	ただし、	但し、	style:但し↔ただし
ついにふなびんはなくなったか。	ついに船便はなくなったか。	ついに船便は無くなったか。	style:無く↔なく
つかいかたにとくにもんだいとなるてんはなく	使い方に特に問題となる点はなく	使い方に特に問題となる点は無く	style:無く↔なく
どのひならいるかをきいておく。	どの日ならいるかを聞いておく。	どの日なら居るかを聞いておく。	style:居る↔いる
なくてはならない	なくてはならない	無くてはならない	style:無く↔なく
なくもがな	なくもがな	無くもがな	style:無く↔なく
なにくれとなく	何くれとなく	何くれと無く	style:無く↔なく
にはすでにはいっていますね	には既に入っていますね	にはすでに入っていますね	style:既に↔すでに
はやくふろにはいらないとねるじかんがなくなる	早く風呂に入らないと寝る時間がなくなる	早く風呂に入らないと寝る時間が無くなる	style:無く↔なく
ゆーざのにゅうりょくからがくしゅうされたでーたおよびとうろくされたたんごは	ユーザの入力から学習されたデータおよび登録された単語は	ユーザの入力から学習されたデータ及び登録された単語は	style:及び↔および
よけいにやるきがなくなる	余計にやる気がなくなる	余計にやる気が無くなる	style:無く↔なく
れこーどがいしゃのきょかなくちゃくうたをはいしんした	レコード会社の許可なく着うたを配信した	レコード会社の許可無く着うたを配信した	style:無く↔なく
このはがきはさいせいしです	このハガキは再生紙です	この葉書は再製紙です	corpus_questionable:再製紙→再生紙
けさはよくひえた	今朝はよく冷えた	今朝は良く冷えた	style:良く→よく
このきせつ、いなかにいたころはよくたべてました。	この季節、田舎にいた頃はよく食べてました。	この季節、田舎にいた頃は良く食べてました。	style:良く→よく
こんねんどのけっさんをよくみせることがもくてきのようです	今年度の決算をよく見せることが目的のようです	今年度の決算を良く見せることが目的のようです	style:良く→よく
しかしよくできていますね。	しかしよくできていますね。	しかし良くできていますね。	style:良く→よく
しったかはよくないですね	知ったかはよくないですね	知ったかは良くないですね	style:良く→よく
ちょーくのこなはめによくない	チョークの粉は目によくない	チョークの粉は目に良くない	style:良く→よく
としをとるとものわすれがよくてこまる	年を取ると物忘れが良くて困る	年を取ると物忘れがよくて困る	style:良く→よく
とてもけしきもよくきもちのいいしつげん	とても景色もよく気持ちのいい湿原	とても景色も良く気持ちのいい湿原	style:良く→よく
よりよくするために	よりよくするために	より良くするために	style:良く→よく
かみならぬみのしるよしもなし	神ならぬ身の知る由もなし	神ならぬ身の知る由も無し	style:無し→なし
きょかをもらってにっきのぶんしょうをしゃきょうする	許可をもらって日記の文章を写経する	許可を貰って日記の文章を写経する	style:貰→もら
きれいにいんじできてよかったですよ	きれいに印字できて良かったですよ	綺麗に印字できてよかったですよ	style:綺麗→きれい,よかった→良かった
ごへんかんにからんだかいすうがいっていかいすうをこえると	誤変換に絡んだ回数が一定回数を超えると	誤変換にからんだ回数が一定回数を越えると	style:からんだ→絡んだ
さびしいきはします	寂しい気はします	さびしい気はします	style:さびし→寂し
しるなしたんたんめんをたべた	汁無し坦々麺を食べた	汁なし坦々麺を食べた	style:なし→無し
そんなものをもらってもおくばしょにこまるな	そんなものをもらっても置く場所に困るな	そんな物を貰っても置く場所に困るな	style:貰→もら,物→もの
たくさんもらっても	たくさんもらっても	沢山貰っても	style:貰→もら,沢山→たくさん
みるひつようなし	見る必要なし	見る必要無し	style:無し→なし
ろーまじにゅうりょくがめんどうなくていいですね	ローマ字入力が面倒なくていいですね	ローマ字入力が面倒無くて良いですね	style:無く→なく,良い→いい
さけのみのくせにけんこうだ	酒飲みの癖に健康だ	酒飲みのくせに健康だ	style:癖↔くせ
「みちゃだめ」	「見ちゃだめ」	「見ちゃダメ」	style:ダメ↔だめ
あれはだめですね	あれはだめですね	あれはダメですね	style:ダメ↔だめ
いちやにしてごみやまとかした	一夜にしてごみ山と化した	一夜にしてゴミ山と化した	style:ゴミ↔ごみ
おまえらどっちもあほだな	お前らどっちもあほだな	お前らどっちもアホだな	style:アホ↔あほ
けんりってあほかと	権利ってあほかと	権利ってアホかと	style:アホ↔あほ
これぐらいでおどろいていてはだめです	これぐらいで驚いていてはだめです	これぐらいで驚いていてはダメです	style:ダメ↔だめ
こんなことになるとはよそうしてませんでしたよまじで	こんなことになるとは予想してませんでしたよまじで	こんなことになるとは予想してませんでしたよマジで	style:マジ↔まじ
ごみはとうじつのあさまでにだしましょう	ごみは当日の朝までに出しましょう	ゴミは当日の朝までに出しましょう	style:ゴミ↔ごみ
ごみはぶんべつはいきしてください	ごみは分別廃棄してください	ゴミは分別廃棄してください	style:ゴミ↔ごみ
さいじっこうしないとだめ	再実行しないとだめ	再実行しないとダメ	style:ダメ↔だめ
じぎょうけいごみのゆうりょうか	事業系ごみの有料化	事業系ゴミの有料化	style:ゴミ↔ごみ
すみません、ふぁいるはじぶんでさくせいしないとだめかもしれません	すみません、ファイルは自分で作成しないとだめかもしれません	すみません、ファイルは自分で作成しないとダメかもしれません	style:ダメ↔だめ
ぜったいぱすじゃないとだめ	絶対パスじゃないとだめ	絶対パスじゃないとダメ	style:ダメ↔だめ
それはだめですね	それはだめですね	それはダメですね	style:ダメ↔だめ
そんなあほな	そんなあほな	そんなアホな	style:アホ↔あほ
そんなあほな！	そんなあほな！	そんなアホな!	style:アホ↔あほ
たいおうしなきゃだめですけど	対応しなきゃだめですけど	対応しなきゃダメですけど	style:ダメ↔だめ
だめすぎますね	だめすぎますね	ダメすぎますね	style:ダメ↔だめ
だめそうなきがしますな	だめそうな気がしますな	ダメそうな気がしますな	style:ダメ↔だめ
だめなかのうせいがあるということですか	だめな可能性があるということですか	ダメな可能性があるということですか	style:ダメ↔だめ
だめになるかのうせいもあるので	だめになる可能性もあるので	ダメになる可能性もあるので	style:ダメ↔だめ
とくにせれぶでもないのにいいとしこいてしょうかくしないのはだめですか？	特にセレブでもないのにいい年こいて昇格しないのはだめですか？	特にセレブでもないのにいい年こいて昇格しないのはダメですか?	style:ダメ↔だめ
どちらかでなくてはだめということはないです	どちらかでなくてはだめということはないです	どちらかでなくてはダメということはないです	style:ダメ↔だめ
なんとかしないとだめなすくえないじょうきょう	何とかしないとだめな救えない状況	何とかしないとダメな救えない状況	style:ダメ↔だめ
にかいたらだめということですかね	に書いたらだめということですかね	に書いたらダメということですかね	style:ダメ↔だめ
のばあいはそうたいぱすじゃないとだめで	の場合は相対パスじゃないとだめで	の場合は相対パスじゃないとダメで	style:ダメ↔だめ
はぜんぜんだめなのでやりますけど	は全然だめなのでやりますけど	は全然ダメなのでやりますけど	style:ダメ↔だめ
ばいとでもてをくわえたらだめそうにみえますね	バイトでも手を加えたらだめそうに見えますね	バイトでも手を加えたらダメそうに見えますね	style:ダメ↔だめ
まじでみるかちないです	まじで見る価値ないです	マジで見る価値ないです	style:マジ↔まじ
もうちょっとまじめにめいろのつくりかたをかんがえないとだめだな	もうちょっと真面目に迷路の作り方を考えないとだめだな	もうちょっと真面目に迷路の作り方を考えないとダメだな	style:ダメ↔だめ
ようきほうそうごみ	容器包装ごみ	容器包装ゴミ	style:ゴミ↔ごみ
りりーすしなきゃだめですよね	リリースしなきゃだめですよね	リリースしなきゃダメですよね	style:ダメ↔だめ
ろーかるでためしてもだめだったのでべつのほうほうをかんがえる	ローカルで試してもだめだったので別の方法を考える	ローカルで試してもダメだったので別の方法を考える	style:ダメ↔だめ
わすれちゃだめですよ	忘れちゃだめですよ	忘れちゃダメですよ	style:ダメ↔だめ
たばたくんのことかな	田畑勲のことかな	田畑君の事かな	corpus_outdated:田畑勲(サッカー選手)
いつのまにそんなにちからをつけていたんだろう	いつの間にそんなに力をつけていたんだろう	いつの間にそんなに力を付けていたんだろう	style:付け↔つけ
だんだんめんどうになってきたのですが、	だんだん面倒になってきたのですが、	段々面倒になってきたのですが、	style:段々↔だんだん
ちょうさしていただきありがとうございました	調査していただきありがとうございました	調査していただき有難うございました	style:有難う↔ありがとう
でーもんにひとのなまえをつけてるんですか	デーモンに人の名前をつけてるんですか	デーモンに人の名前を付けてるんですか	style:付け↔つけ
にしてもいいよというものいがいうけつけないことにしました	にしてもいいよというもの以外受け付けないことにしました	にしてもいいよというもの以外受けつけないことにしました	style:付け↔つけ
みそをつける	味噌をつける	味噌を付ける	style:付け↔つけ
めーかのかんむりつけただけなのはじょがい	メーカの冠つけただけなのは除外	メーカの冠付けただけなのは除外	style:付け↔つけ
かりとうろくとほんとうろくのちがいはなんですか？	仮登録と本登録の違いはなんですか？	仮登録と本登録の違いは何ですか?	style:何で↔なんで
どようびにしまっていたのでなんでだろ	土曜日にしまっていたのでなんでだろ	土曜日にしまっていたので何でだろ	style:何で↔なんで
なぜかじゅうでんできずに	何故か充電できずに	なぜか充電できずに	style:何故↔なぜ
なんでうちだとだいじょうぶなんでしょうなぁ	なんでうちだと大丈夫なんでしょうなぁ	何でうちだと大丈夫なんでしょうなぁ	style:何で↔なんで
なんでこんなにたかいところなんだろう？	なんでこんなに高いところなんだろう？	何でこんなに高いところなんだろう？	style:何で↔なんで
めもりりーくするのはなんでだろう	メモリリークするのはなんでだろう	メモリリークするのは何でだろう	style:何で↔なんで
でゅあるでつかってもうまくきょうちょうしてうごいてくれない	デュアルで使ってもうまく協調して動いてくれない	デュアルで使ってもうまく強調して動いてくれない	corpus_wrong:強調→協調が正しい
でんあつかけながらはんだづけしたのですか？	電圧かけながらはんだ付けしたのですか？	電圧かけながらハンダ付けしたのですか?	style:ハンダ↔はんだ
とーくもしごとのうちとかんがえているふしがある	トークも仕事のうちと考えている節がある	トークも仕事のうちと考えているフシがある	style:フシ↔節
いまいちというのがていせつですからね	いまいちというのが定説ですからね	いまいちと言うのが定説ですからね	style:と言う↔という
おりたたんでください	折りたたんでください	折り畳んでください	style:畳んで↔たたんで
というげんいんがかんがえられます。	という原因が考えられます。	と言う原因が考えられます。	style:と言う↔という
というてんで	という点で	と言う点で	style:と言う↔という
となりのひとがにもつをたたんでいた	隣の人が荷物を畳んでいた	隣の人が荷物をたたんでいた	style:畳んで↔たたんで
となりのやつのでんわがうるさい	隣のやつの電話がうるさい	隣の奴の電話がうるさい	style:奴↔やつ
とびらをあけたらまずいものをもくげきしてしまう	扉を開けたらまずいものを目撃してしまう	扉を開けたらマズい物を目撃してしまう	style:マズい→まずい,物→もの
あのせんをこえればきのうにたどりつく	あの線を超えれば昨日にたどり着く	あの線を越えれば昨日にたどり着く	style:越え↔こえ,超え↔こえ
いつかのぼれるちからがつくんでしょうか。	いつか登れる力がつくんでしょうか。	いつか登れる力が付くんでしょうか。	style:付く↔つく
きづかずにきょねんとおなじねたをやってしまった	気づかずに去年と同じネタをやってしまった	気付かずに去年と同じネタをやってしまった	style:気付↔気づ
こえればおおいのに	超えれば多いのに	越えれば多いのに	style:越え↔こえ,超え↔こえ
じっさいにもくげきするまでうたがうようそはなかったわけです	実際に目撃するまで疑う要素はなかったわけです	実際に目撃するまで疑う要素は無かったわけです	style:無かった↔なかった
すこしはちからがついているのがわかる	少しは力がついているのがわかる	少しは力が付いているのが分かる	style:分かる↔わかる,付い↔つい
たいるのしたがわについている	タイルの下側についている	タイルの下側に付いている	style:付い↔つい
ちいさいころはわだいについていけなかった	小さい頃は話題についていけなかった	小さい頃は話題に付いていけなかった	style:付い↔つい
てぶくろがついている	手袋がついている	手袋が付いている	style:付い↔つい
とりにいったけどなかった	取りに行ったけどなかった	取りに行ったけど無かった	style:無かった↔なかった
どういうふうにおーそらいずされればほんものというのかわからないですが	どういうふうにオーソライズされれば本物というのかわからないですが	どういう風にオーソライズされれば本物というのか分からないですが	style:物↔もの,分からない↔わからない,風に↔ふうに
なまけぐせがつく	怠け癖がつく	怠け癖が付く	style:癖↔くせ,付く↔つく
はこえています	は超えています	は越えています	style:越え↔こえ,超え↔こえ
はこえてます	は超えてます	は越えてます	style:越え↔こえ,超え↔こえ
ひるごはんがつく	昼ご飯がつく	昼ご飯が付く	style:付く↔つく
