# 入力読み	許容するakaza出力	corpus期待値	理由
りすとをながめてみたけどさぷらいずはなかったです	リストを眺めてみたけどサプライズはなかったです	リストを眺めてみたけどサプライズは無かったです	style:無かった↔なかった
をこえることはほぼかくじつなじょうせいですが	を超えることはほぼ確実な情勢ですが	を越えることはほぼ確実な情勢ですが	style:越え↔こえ,超え↔こえ
をこえるときろくできなくなるようです	を超えると記録できなくなるようです	を越えると記録できなくなるようです	style:越え↔こえ,超え↔こえ
かんじへんかんがおばかだというしてきがながくつづいていましたが、	漢字変換がお馬鹿だという指摘が長く続いていましたが、	漢字変換がおバカだという指摘が長く続いていましたが、	style:バカ↔馬鹿
それならばかでもできるし	それなら馬鹿でもできるし	それならバカでもできるし	style:バカ↔馬鹿
ばかにはばかなりのいきかたがある	馬鹿には馬鹿なりの生き方がある	バカにはバカなりの生き方がある	style:バカ↔馬鹿
かぜひきそうなじょうきょう	風邪ひきそうな状況	風邪引きそうな状況	style:訳↔わけ,引き↔ひき
ひきこもってげーむしていたわけですが	ひきこもってゲームしていたわけですが	引きこもってゲームしていた訳ですが	style:訳↔わけ,引き↔ひき
わけはない	わけはない	訳はない	style:訳↔わけ,引き↔ひき
きょうはふどうさんやにいってひっこしさきのぶっけんをえらんできました	今日は不動産屋に行って引っ越し先の物件を選んできました	今日は不動産屋に行って引越し先の物件を選んできました	style:引越し↔引っ越し
ひっこしのじゅんびはたいへんですねえ	引っ越しの準備は大変ですねえ	引越しの準備は大変ですねえ	style:引越し↔引っ越し
うーん、わりととおいとおもいますけどねぇ	うーん、割と遠いと思いますけどねぇ	うーん、わりと遠いと思いますけどねぇ	style:割と↔わりと
ちばもわりとむてきなかんじなんですか	千葉も割と無敵な感じなんですか	千葉もわりと無敵な感じなんですか	style:割と↔わりと
わりとかんたんだとおもいますけどね	割と簡単だと思いますけどね	わりと簡単だと思いますけどね	style:割と↔わりと
わりとなつかしいきゃらですね	割と懐かしいキャラですね	わりと懐かしいキャラですね	style:割と↔わりと
こうぼからうまれた	公募から生まれた	酵母から生まれた	short_ambiguous:酵母/公募
そくどがこうじょうしたにもかかわらず	速度が向上したにもかかわらず	速度が向上したにも関わらず	style:関わらず↔かかわらず
とくにしぜんとのかかわりのなかではぐくまれた	特に自然との関わりの中で育まれた	特に自然とのかかわりの中で育まれた	style:関わり↔かかわり
あしたはあさはやいからねる	明日は朝早いからねる	明日は朝早いから寝る	style:寝る↔ねる
おれのとなりでねてるよ	俺の隣でねてるよ	俺の隣で寝てるよ	style:寝て↔ねて
きょうはさっさとねることにします	今日はさっさとねることにします	今日はさっさと寝ることにします	style:寝る↔ねる
ねてるんだけど	ねてるんだけど	寝てるんだけど	style:寝て↔ねて
ねるのでいそがしいようです。	ねるので忙しいようです。	寝るので忙しいようです。	style:寝る↔ねる
ねるまえのいめとれですかね。	ねる前のイメトレですかね。	寝る前のイメトレですかね。	style:寝る↔ねる
のこしつつほんとにねるですよ	残しつつほんとにねるですよ	残しつつほんとに寝るですよ	style:寝る↔ねる
はやくかえってすうじかんねる	早く帰って数時間ねる	早く帰って数時間寝る	style:寝る↔ねる
まったりねるのがもくひょう	まったりねるのが目標	まったり寝るのが目標	style:寝る↔ねる
かるくききかんをおぼえるできごとですね	軽く危機感を覚える出来事ですね	軽く危機感を覚えるできごとですね	style:できごと↔出来事
きょうはなんだかげんきがいい	今日はなんだか元気がいい	今日は何だか元気がいい	style:何だか↔なんだか
なにかのみものとってくる	なにか飲み物取って来る	何か飲み物とってくる	style:何か↔なにか,取って来る↔とってくる
こくないばんもでるよていで	国内版も出る予定で	国内盤も出る予定で	style:盤↔版
しょうせつはおもしろかった	小説は面白かった	小説はおもしろかった	style:おもしろい↔面白い
やみよのからす	闇夜のカラス	闇夜の烏	style:烏↔カラス
てこでもうごかない	てこでも動かない	梃子でも動かない	style:梃子↔てこ
どうしようもないほどみたいなら	どうしようもないほど見たいなら	どうしようもない程見たいなら	style:程↔ほど
でんちがよわくなってきたみたいだと	電池が弱くなってきたみたいだと	電池が弱くなって来たみたいだと	style:来た↔きた
わがくににとどまらず	我が国にとどまらず	わが国にとどまらず	style:わが国↔我が国
はげたいさくをすすめている	禿対策を進めている	ハゲ対策を進めている	style:ハゲ↔禿
あのおかまでいくにはどうすればよいですか？	あの丘まで行くにはどうすればよいですか？	あの丘まで行くにはどうすれば良いですか?	style:良い↔よい
のどごしがよくない	のどごしがよくない	喉ごしが良くない	style:喉ごし↔のどごし+良く↔よく
たががゆるむ	たがが緩む	箍が緩む	style:箍↔たが
ねつをあげる	熱を上げる	熱をあげる	style:あげる↔上げる
やめておいたほうがよいだろう	やめておいた方が良いだろう	止めておいた方が良いだろう	style:止めて↔やめて
だんじてゆるすわけにはいかない	断じて許すわけには行かない	断じて許すわけにはいかない	style:いかない↔行かない
くつしたとずぼんのすそのあいだ	靴下とズボンの裾のあいだ	靴下とズボンの裾の間	style:間↔あいだ
いちにちごとに	一日ごとに	一日毎に	style:毎に↔ごとに
めあどがしょうめつしてもかまいません	メアドが消滅してもかまいません	メアドが消滅しても構いません	style:構い↔かまい
ついにしゅとこうでびゅーですか	ついに首都高デビューですか	遂に首都高デビューですか	style:遂に↔ついに
なげかわしいわがくにのげんじょうなのです	嘆かわしい我が国の現状なのです	嘆かわしいわが国の現状なのです	style:わが国↔我が国
まともににほんごにゅうりょくできるようになるひがくるとはおもえないんですよねぇ	まともに日本語入力できるようになる日が来るとは思えないんですよねぇ	まともに日本語入力できるようになる日がくるとは思えないんですよねぇ	style:くる↔来る
でんわばんごうがでてくるきもしますが	電話番号が出て来る気もしますが	電話番号が出てくる気もしますが	style:てくる↔て来る
したまちじょうちょあふれる	下町情緒あふれる	下町情緒溢れる	style:溢れる↔あふれる
せつだんされているのではないかというかせつをたててみましたが	切断されているのではないかという仮説を立てて見ましたが	切断されているのではないかという仮設を立ててみましたが	style:仮設↔仮説,みた↔見た
くまをやせいのままに	熊を野生のままに	熊を野性のままに	style:野性↔野生
おとのしんどうをずがいこつにつたえてないじでかんじとる	音の振動を頭蓋骨に伝えて内耳で感じ取る	音の振動を頭骸骨に伝えて内耳で感じ取る	style:頭骸骨↔頭蓋骨
こうかいされてももんだいのない	公開されても問題のない	公開されても問題野内	corpus_wrong:問題野内→問題のない
いいきょくは、どんながっきでえんそうしてもきくにたえます。	良い曲は、どんな楽器で演奏しても聴くに耐えます。	いい曲は、どんな楽器で演奏しても聞くに耐えます。	style:良い→いい,聴く→聞く
もみあいがつづいている	もみ合いが続いている	揉み合いが続いている	style:揉み合い→もみ合い
うのまねをするからす	鵜の真似をする烏	鵜のまねをするカラス	style:真似→まね,烏→カラス
はなしがかみあわない	話がかみ合わない	話が噛み合わない	style:噛み合わない→かみ合わない
おおぞらをおよぐこいのぼりにまけないように	大空を泳ぐ鯉幟に負けないように	大空を泳ぐ鯉のぼりに負けないように	style:鯉のぼり→鯉幟
いえとかいしゃのあいだでもってあるいていたら、	家と会社の間で持って歩いていたら、	家と会社のあいだで持って歩いていたら、	style:あいだ→間
そこがしれている	底が知れている	そこが知れている	style:そこ→底
ぶんせつのながさをれいぶんでしめされたものにあわせる	文節の長さを例文で示された物にあわせる	文節の長さを例文で示されたものに合わせる	style:物→もの
のみくいででたごみをぜんぶくるまではこんでもらった	飲み食いで出たゴミを全部車で運んでもらった	飲み食いで出たごみを全部くるまで運んでもらった	style:ゴミ→ごみ,車→くるま
はらどけいがなる	腹時計が鳴る	腹時計がなる	style:なる→鳴る
ひっこしさきはいまのへやよりせまくなるのでたいへんです。	引越先は今の部屋より狭くなるので大変です。	引っ越し先は今の部屋より狭くなるので大変です。	style:引っ越し先→引越先
とっつきがわるい	取っ付きが悪い	とっつきが悪い	style:とっつき→取っ付き
つゆといいつつあめがふらないようなので、	梅雨といいつつ雨が降らないようなので、	つゆと言いつつ雨が降らないようなので、	style:つゆ→梅雨,言いつつ→いいつつ
つつがなくしゅうりょうしました	恙無く終了しました	つつがなく終了しました	style:つつがなく→恙無く
ぜんぜんおぼえてなくてだめぽ	全然覚えてなくてだめぽ	全然覚えてなくて駄目ぽ	style:駄目→だめ
ぶしつよってじゅうでんしてからかえる	部室寄って充電してから帰る	部室よって充電してから帰る	style:よって→寄って
ごらんください	ご覧ください	ごらんください	style:ごらん→ご覧
つかいかたぜんぜんわかってないのですが	使い方全然分かってないのですが	使い方全然わかってないのですが	style:分かる→わかる
なごやでみそかつにしたづつみ	名古屋で味噌カツに舌鼓	名古屋で味噌かつに舌鼓	style:かつ→カツ
ごくいちぶのさいと	極一部のサイト	ごく一部のサイト	style:ごく→極
とんちんかんな	頓珍漢な	とんちんかんな	style:とんちんかん→頓珍漢
どうやらいっぴきのかをいえにまねきいれてしまったようだ。	どうやら一匹の蚊を家に招き入れてしまったようだ。	どうやら一疋のかを家に招き入れてしまったようだ。	style:一疋→一匹,か→蚊
みぎといえばひだり	右と言えば左	右といえば左	style:いえば→言えば
しんぷるすぎて	シンプル過ぎて	シンプルすぎて	style:すぎて→過ぎて
ってかなってないとだめです	ってかなってないとダメです	ってかなってないと駄目です	style:駄目→ダメ
そんなややこしいつみをせおっていきるのはつらい	そんなややこしい罪を背負って生きるのは辛い	そんなややこしい罪を背負って生きるのはつらい	style:つらい→辛い
いかようにもへんこうできるとおもいます	いかようにも変更できると思います	如何様にも変更できると思います	style:如何様→いかよう
そのあとはもうなんでもいいです	その後はもうなんでもいいです	そのあとはもうなんでもいいです	style:あと→後
いまのところはみるよてい	いまのところは見る予定	今のところは見る予定	style:今→いま
じかんをはかればぼとるねっくはみつかりますね	時間を計ればボトルネックは見つかりますね	時間を測ればボトルネックは見つかりますね	style:測れば→計れば
きみではうまくできない	君では上手くできない	君ではうまくできない	style:うまく→上手く
そのかばんをおいてでかけるのはむりだろう	そのカバンを置いて出かけるのは無理だろう	その鞄を置いて出かけるのは無理だろう	style:鞄→カバン
ほしいものがあって	欲しい物があって	ほしいものがあって	style:欲しい→ほしい,物→もの
ちかてつはえらいちかをはしるんですな	地下鉄はエラい地下を走るんですな	地下鉄はえらい地下を走るんですな	style:えらい→エラい
けいきづけに	景気付けに	景気づけに	style:づけ→付け
みんなそうおもうとおもうよ	みんなそう思うと思うよ	みんなそう思うと想うよ	style:想う→思う
せかいからとりのこされるだけなので	世界からとり残されるだけなので	世界から取り残されるだけなので	style:取り→とり
でんきがついていなかったのでとおりすぎて	電気が点いていなかったので通り過ぎて	電気がついていなかったので通り過ぎて	style:ついて→点いて
あわびのかたおもい	鮑の片思い	鮑の片想い	style:片想い→片思い
あすのてんきびみょうですね。	明日の天気微妙ですね。	あすの天気微妙ですね。	style:あす→明日
わたしがとうちゃくするいっしゅうかんぐらいまえ	私が到着する一週間位前	私が到着する一週間ぐらい前	style:ぐらい→位
なんてすてればいいのに	何て捨てればいいのに	なんて捨てればいいのに	style:なんて→何て
とんびにあぶらあげをさらわれる	鳶に油揚げをさらわれる	とんびに油揚げをさらわれる	style:とんび→鳶
かいものだ。。。	買い物だ…	買い物だ。。。	punctuation_style
まわりのひとがすごいだけ	まわりの人が凄いだけ	周りの人がすごいだけ	style:周り→まわり,すごい→凄い
せけんばなしできないとびよういんはつらい	世間話できないと美容院は辛い	世間話できないと美容院はつらい	style:つらい→辛い
したをかむ	舌を噛む	したを噛む	style:した→舌
しながらみるようにはなりました	しながら見るようにはなりました	しながら見るようにはなリマした	corpus_wrong:corpus側の「なリマした」が明らかな誤表記
よしんやつなみにおびえながら	余震や津波に怯えながら	余震や津波におびえながら	style:おびえ/怯え はどちらも自然な表記揺れ
なんならにちようびにおわたししますけど	なんなら日曜日にお渡ししますけど	何なら日曜日にお渡ししますけど	style:なんなら/何なら はどちらも自然な表記
あつめはじめてから	集め始めてから	集めはじめてから	style:はじめて/始めて は補助動詞として両方自然
というかんてんでいえば	という観点で言えば	という観点でいえば	style:いえば/言えば はどちらも自然な表記
そもそもそのだんかいまできてない	そもそもその段階まで来てない	そもそもその段階まできてない	style:きて/来て はどちらも自然な表記
すぎたるはなおおよばざるがごとし	過ぎたるはなお及ばざるが如し	過ぎたるはなお及ばざるがごとし	style:ごとし/如し はどちらも自然な表記
したにいどう	したに移動	下に移動	style:した/下 はどちらも自然な表記
ちきゅうじょうでせいめいがはっせいしたのはたんなるぐうぜんではないかと	地球上で生命が発生したのは単なる偶然ではないかと	地球上で生命が発生したのは単なる偶然では無いかと	style:無い/ない はどちらも自然な表記揺れ
かなりまえからほかのにまけるようなじょうきょうではなかった	かなり前からほかのに負けるような状況ではなかった	かなり前から他のに負けるような状況ではなかった	style:ほか/他 はどちらも自然な表記揺れ
しょうせつもまんがも	小説も漫画も	小説もマンガも	style:マンガ/漫画 はどちらも自然な表記揺れ
もっといっぱいでーたをあつめることができればよいのですが	もっといっぱいデータを集めることができればよいのですが	もっといっぱいデータを集めることができれば良いのですが	style:良い/よい はどちらも自然な表記揺れ
をみていたときもおもったのですが	を見ていた時も思ったのですが	を見ていたときも思ったのですが	style:とき/時 はどちらも自然な表記揺れ
とりやめる	取りやめる	取り止める	style:止める/やめる はどちらも自然な表記
きろくをさくじょしてもよいか	記録を削除しても良いか	記録を削除してもよいか	style:よい/良い はどちらも自然な表記揺れ
いひょうをつく	意表をつく	意表を衝く	style:衝く/つく はどちらも自然な表記
このまちにきたのははじめてだ	この町にきたのは初めてだ	この街に来たのは初めてだ	style:街/町、来た/きた はどちらも自然な表記揺れ
がっちりつかんであうとにした	がっちり掴んでアウトにした	ガッチリ掴んでアウトにした	style:ガッチリ/がっちり はどちらも自然な表記揺れ
きれいにおわってはいますが	綺麗に終わってはいますが	きれいに終わってはいますが	style:きれい/綺麗 はどちらも自然な表記揺れ
どのていどうまくいくかわかりませんね	どの程度うまく行くかわかりませんね	どの程度うまくいくかわかりませんね	style:「いく/行く」は補助動詞的用法で表記揺れ
やせいのこにはけんこうによくない	野生の子には健康によくない	野性の子には健康に良くない	style:「野性/野生」「良くない/よくない」はいずれも表記揺れ
かれからはへんじがまだなかろう	彼からは返事がまだなかろう	彼からは返事がまだ無かろう	style:「無かろう/なかろう」は表記揺れ
ほうこくされていないぱっちのありかをごぞんじのかたは	報告されていないパッチの在処をご存知の方は	報告されていないパッチのありかをご存知の方は	style:「ありか/在処」は表記揺れ。漢字表記の方が稀
みだしなみ	身だしなみ	身嗜み	style:「身嗜み/身だしなみ」は表記揺れ。ひらがな交じりの方が一般的
すでになんめいのかたからか	既に何名の方からか	すでに何名の方からか	style:「すでに/既に」は表記揺れ
といれぐらいひとりでいけ	トイレぐらいひとりで行け	トイレぐらい一人で行け	style:「一人/ひとり」は表記揺れ
そこへもってきて	そこへ持って来て	そこへ持ってきて	style:「きて/来て」は表記揺れ。慣用句的用法でひらがなが自然だが許容範囲
かいがてんをみにいきました。	絵画展を見に行きました。	絵画展を見にいきました。	style:「いきました/行きました」は表記揺れ
このこたえわかるか	この答えわかるか	この答分かるか	style:「答/答え」の送り仮名差、「分かる/わかる」は表記揺れ
とおりかかる	通りかかる	通り掛かる	style:「掛かる/かかる」は表記揺れ
あうんのこきゅう	阿吽の呼吸	呵吽の呼吸	corpus_wrong:「阿吽」が正しい表記。corpus側の「呵吽」は誤り
おもしろいたいとるですが	面白いタイトルですが	おもしろいタイトルですが	style:「おもしろい/面白い」は表記揺れ
げんがく4じゅうそうきょく	弦楽4重奏曲	弦楽四重奏曲	style:「四重奏/4重奏」は数字表記の揺れ
しっかりとこしまでつかる	しっかりと腰まで浸かる	しっかりと腰までつかる	style:「つかる/浸かる」は表記揺れ
おんげんはないようです。	音源はないようです。	音源は無いようです。	style:「無い/ない」は表記揺れ
みどころのある	見どころのある	見所のある	style:「見所/見どころ」は表記揺れ
ごまをする	ごまをする	ゴマをする	style:「ゴマ/ごま」はカタカナ・ひらがなの表記揺れ
ほんのひとにぎりの	ほんのひと握りの	ほんの一握りの	style:「一握り/ひと握り」は表記揺れ
つけがまわってくる	つけが回ってくる	付けが回ってくる	style:「付け/つけ」は表記揺れ
なんかめーるきてましたね	なんかメール来てましたね	なんかメールきてましたね	style:「きて/来て」は表記揺れ
ぜんこくのだいがくなどをちゅうしんにもういをふるう	全国の大学などを中心に猛威を振るう	全国の大学などを中心に猛威をふるう	style:「猛威をふるう」はひらがな表記も「振るう」も両方自然
のうきがせまるなどかいはつがいそがしい	納期が迫るなど開発が忙しい	納期が迫る等開発が忙しい	style:「等」と「など」はどちらも自然な表記
がぞうのるいじせいにめをつけたけんさく	画像の類似性に目を付けた検索	画像の類似性に目をつけた検索	style:「目をつけた」と「目を付けた」はどちらも自然な表記
そんけいのねんさえいだいていた	尊敬の念さえいだいていた	尊敬の念さえ抱いていた	style:「抱いて」と「いだいて」はどちらも自然な表記
どのくらいなのか	どのくらいなのか	どの位なのか	style:「位」と「くらい」はどちらも自然な表記
あーいうことをかいたらきょひはんのうがでるのはしかたないとおもいます	あーいうことを書いたら拒否反応が出るのは仕方ないと思います	あー言うことを書いたら拒否反応が出るのは仕方ないと思います	style:「あー言う」と「あーいう」はどちらも自然な表記
きょうはよいひょうじょうがたくさんみられたとおもいます。	今日は良い表情がたくさん見られたと思います。	今日はよい表情がたくさん見られたと思います。	style:「よい」と「良い」はどちらも自然な表記
むくのがめんどくさいので。	剥くのがめんどくさいので。	剥くのが面倒くさいので。	style:「面倒くさい」と「めんどくさい」はどちらも自然な表記
だめおしをする	ダメ押しをする	駄目押しをする	style:「駄目押し」と「ダメ押し」はどちらも自然な表記
はるやさいのうまみをあじわう	春野菜の旨味を味わう	春野菜のうまみを味わう	style:「うまみ」と「旨味」はどちらも自然な表記
なかだるみ	中だるみ	中弛み	style:「中弛み」と「中だるみ」はどちらも自然な表記
おとこはしばらくのあいだぽかんとくちをあけて	男はしばらくのあいだぽかんと口を開けて	男はしばらくの間ポカンと口を開けて	style:「間」と「あいだ」、「ポカン」と「ぽかん」はどちらも自然
みこしをあげる	御輿をあげる	みこしを上げる	style:「みこし」と「御輿」、「上げる」と「あげる」の表記揺れ。双方向の違い
おなかがすいていないことで	お腹がすいていないことで	お腹が空いていないことで	style:「空いて」と「すいて」はどちらも自然な表記
いまをときめく	今をときめく	今を時めく	style:「時めく」と「ときめく」はどちらも自然な表記
みなさんほとんどぜんいんのこってた	皆さんほとんど全員残ってた	皆さん殆ど全員残ってた	style:「殆ど」と「ほとんど」はどちらも自然な表記
